{
  "schemaVersion": 1,
  "version": "v1-2026-05-25",
  "nodes": [
    {
      "id": "V1",
      "layer": "V",
      "name": "기본 어휘 의미",
      "nameEn": "Basic vocabulary meaning",
      "description": "단어의 가장 기본적인 의미를 인식",
      "gradeLevel": "elem_4_6",
      "measuredByDims": ["D2_Meaning"],
      "measuredByQts": [],
      "measuredByKeyVars": [],
      "mvpActive": true
    },
    {
      "id": "V2",
      "layer": "V",
      "name": "품사 인식",
      "nameEn": "Part-of-speech recognition",
      "description": "단어의 품사를 식별",
      "gradeLevel": "elem_4_6",
      "measuredByDims": ["D1_Form"],
      "measuredByQts": [],
      "measuredByKeyVars": [],
      "mvpActive": true
    },
    {
      "id": "V3",
      "layer": "V",
      "name": "단어 가족 이해",
      "nameEn": "Word family",
      "description": "어근/접사를 통한 의미 연관 파악",
      "gradeLevel": "middle",
      "measuredByDims": ["D4_Network"],
      "measuredByQts": [],
      "measuredByKeyVars": [],
      "mvpActive": true
    },
    {
      "id": "V4",
      "layer": "V",
      "name": "다의어 이해",
      "nameEn": "Polysemy",
      "description": "맥락에 따른 단어 의미 분기",
      "gradeLevel": "middle",
      "measuredByDims": ["D2_Meaning", "D3_Context"],
      "measuredByQts": [],
      "measuredByKeyVars": [],
      "mvpActive": true
    },
    {
      "id": "V5",
      "layer": "V",
      "name": "collocation 이해",
      "nameEn": "Collocation",
      "description": "자연스러운 단어 결합 인식",
      "gradeLevel": "middle",
      "measuredByDims": ["D4_Network"],
      "measuredByQts": [],
      "measuredByKeyVars": [],
      "mvpActive": true
    },
    {
      "id": "S1",
      "layer": "S",
      "name": "기본 문장 구조",
      "nameEn": "Basic sentence structure",
      "description": "주어/동사/목적어 기본 구조 파악",
      "gradeLevel": "elem_4_6",
      "measuredByDims": ["D1_Form"],
      "measuredByQts": [],
      "measuredByKeyVars": [],
      "mvpActive": true
    },
    {
      "id": "S2",
      "layer": "S",
      "name": "주어-동사 파악",
      "nameEn": "Subject-verb identification",
      "description": "긴 문장에서 핵심 주어와 동사 식별",
      "gradeLevel": "middle",
      "measuredByDims": ["D1_Form", "D3_Context"],
      "measuredByQts": [],
      "measuredByKeyVars": [],
      "mvpActive": true
    },
    {
      "id": "S3",
      "layer": "S",
      "name": "수식어 범위 파악",
      "nameEn": "Modifier scope",
      "description": "수식어가 어디까지 걸리는지 식별",
      "gradeLevel": "middle",
      "measuredByDims": ["D3_Context"],
      "measuredByQts": [],
      "measuredByKeyVars": [],
      "mvpActive": true
    },
    {
      "id": "S4",
      "layer": "S",
      "name": "절 구조 이해",
      "nameEn": "Clause structure",
      "description": "관계절·명사절·부사절 구조 파악",
      "gradeLevel": "middle",
      "measuredByDims": ["D1_Form", "D3_Context"],
      "measuredByQts": [],
      "measuredByKeyVars": [],
      "mvpActive": true
    },
    {
      "id": "S5",
      "layer": "S",
      "name": "긴 문장 끊어 읽기",
      "nameEn": "Long sentence chunking",
      "description": "복문을 의미 단위로 분절",
      "gradeLevel": "high",
      "measuredByDims": ["D3_Context"],
      "measuredByQts": [],
      "measuredByKeyVars": ["paragraph_dependency"],
      "mvpActive": true
    },
    {
      "id": "D1",
      "layer": "D",
      "name": "문맥 이해",
      "nameEn": "Context comprehension",
      "description": "주변 맥락으로 의미 추정",
      "gradeLevel": "middle",
      "measuredByDims": ["D3_Context"],
      "measuredByQts": [],
      "measuredByKeyVars": ["context_clue"],
      "mvpActive": true
    },
    {
      "id": "D2",
      "layer": "D",
      "name": "대명사·지시어 추적",
      "nameEn": "Anaphora tracking",
      "description": "it/this/that 등이 가리키는 대상 추적",
      "gradeLevel": "middle",
      "measuredByDims": ["D3_Context"],
      "measuredByQts": [],
      "measuredByKeyVars": [],
      "mvpActive": true
    },
    {
      "id": "D3",
      "layer": "D",
      "name": "연결어 이해",
      "nameEn": "Connectives",
      "description": "however/therefore 등 연결어로 흐름 파악",
      "gradeLevel": "middle",
      "measuredByDims": ["D3_Context"],
      "measuredByQts": [],
      "measuredByKeyVars": ["connective_density", "discourse_marker_density"],
      "mvpActive": true
    },
    {
      "id": "D4",
      "layer": "D",
      "name": "문장 간 관계 파악",
      "nameEn": "Inter-sentence relations",
      "description": "두 문장 사이의 논리·의미 연결",
      "gradeLevel": "high",
      "measuredByDims": ["D3_Context"],
      "measuredByQts": [],
      "measuredByKeyVars": ["coherence_gap", "coherence_disruption"],
      "mvpActive": true
    },
    {
      "id": "D5",
      "layer": "D",
      "name": "요지 파악",
      "nameEn": "Main idea",
      "description": "글의 핵심 주장·요지 식별",
      "gradeLevel": "high",
      "measuredByDims": ["D3_Context", "D4_Network"],
      "measuredByQts": ["TYPE-요지", "TYPE-주제"],
      "measuredByKeyVars": ["topic_sentence_position", "topic_abstractness"],
      "mvpActive": true
    },
    {
      "id": "D6",
      "layer": "D",
      "name": "세부 정보 파악",
      "nameEn": "Detail comprehension",
      "description": "지문의 구체 정보 일치/불일치 판단",
      "gradeLevel": "high",
      "measuredByDims": ["D3_Context"],
      "measuredByQts": [],
      "measuredByKeyVars": [],
      "mvpActive": true
    },
    {
      "id": "D7",
      "layer": "D",
      "name": "문단 구조 파악",
      "nameEn": "Paragraph structure",
      "description": "문단 내 주제문·뒷받침 구조",
      "gradeLevel": "high",
      "measuredByDims": ["D3_Context"],
      "measuredByQts": [],
      "measuredByKeyVars": ["paragraph_dependency", "discourse_structure"],
      "mvpActive": true
    },
    {
      "id": "D8",
      "layer": "D",
      "name": "글 전체 구조 이해",
      "nameEn": "Whole-text structure",
      "description": "도입-전개-결론 등 전체 흐름",
      "gradeLevel": "csat",
      "measuredByDims": ["D4_Network"],
      "measuredByQts": [],
      "measuredByKeyVars": ["discourse_structure", "given_sentence_role"],
      "mvpActive": true
    },
    {
      "id": "R1",
      "layer": "R",
      "name": "원인-결과 추론",
      "nameEn": "Cause-effect inference",
      "description": "암시된 인과관계 추론",
      "gradeLevel": "high",
      "measuredByDims": [],
      "measuredByQts": [],
      "measuredByKeyVars": [],
      "mvpActive": true
    },
    {
      "id": "R2",
      "layer": "R",
      "name": "비교-대조 추론",
      "nameEn": "Compare-contrast inference",
      "description": "비교/대조 구조 추론",
      "gradeLevel": "high",
      "measuredByDims": [],
      "measuredByQts": [],
      "measuredByKeyVars": [],
      "mvpActive": true
    },
    {
      "id": "R3",
      "layer": "R",
      "name": "숨은 전제 파악",
      "nameEn": "Hidden premise",
      "description": "필자가 전제로 하는 미명시 가정 파악",
      "gradeLevel": "high",
      "measuredByDims": [],
      "measuredByQts": ["TYPE-주장"],
      "measuredByKeyVars": ["claim_explicitness"],
      "mvpActive": true
    },
    {
      "id": "R4",
      "layer": "R",
      "name": "필자 의도 추론",
      "nameEn": "Author intent",
      "description": "글을 쓴 목적·의도 추론",
      "gradeLevel": "high",
      "measuredByDims": [],
      "measuredByQts": ["TYPE-목적", "TYPE-주장"],
      "measuredByKeyVars": [],
      "mvpActive": true
    },
    {
      "id": "R5",
      "layer": "R",
      "name": "어조·태도 파악",
      "nameEn": "Tone & attitude",
      "description": "필자의 감정·태도 식별",
      "gradeLevel": "high",
      "measuredByDims": [],
      "measuredByQts": ["TYPE-심경"],
      "measuredByKeyVars": [],
      "mvpActive": true
    },
    {
      "id": "R6",
      "layer": "R",
      "name": "빈칸 추론",
      "nameEn": "Cloze inference",
      "description": "빈칸에 들어갈 핵심 표현 추론",
      "gradeLevel": "csat",
      "measuredByDims": [],
      "measuredByQts": ["TYPE-빈칸추론"],
      "measuredByKeyVars": ["coherence_gap", "abstractness", "context_clue"],
      "mvpActive": true
    },
    {
      "id": "R7",
      "layer": "R",
      "name": "문장 삽입",
      "nameEn": "Sentence insertion",
      "description": "주어진 문장의 적절한 위치 판단",
      "gradeLevel": "csat",
      "measuredByDims": [],
      "measuredByQts": ["TYPE-문장삽입"],
      "measuredByKeyVars": ["given_sentence_role"],
      "mvpActive": true
    },
    {
      "id": "R8",
      "layer": "R",
      "name": "순서 배열",
      "nameEn": "Paragraph ordering",
      "description": "문단들의 논리적 순서 재구성",
      "gradeLevel": "csat",
      "measuredByDims": [],
      "measuredByQts": ["TYPE-순서배열"],
      "measuredByKeyVars": [],
      "mvpActive": true
    },
    {
      "id": "R9",
      "layer": "R",
      "name": "무관 문장 제거",
      "nameEn": "Irrelevant sentence",
      "description": "글의 흐름과 무관한 문장 식별",
      "gradeLevel": "csat",
      "measuredByDims": [],
      "measuredByQts": ["TYPE-흐름무관"],
      "measuredByKeyVars": ["topic_consistency"],
      "mvpActive": true
    },
    {
      "id": "R10",
      "layer": "R",
      "name": "선지 제거 전략",
      "nameEn": "Distractor elimination",
      "description": "오답 선지의 함정 패턴 인식·제거",
      "gradeLevel": "csat",
      "measuredByDims": [],
      "measuredByQts": [],
      "measuredByKeyVars": [],
      "mvpActive": true
    },
    {
      "id": "A1",
      "layer": "A",
      "name": "추상 개념 이해",
      "nameEn": "Abstract concept",
      "description": "추상적 개념의 정의·범위 이해",
      "gradeLevel": "high",
      "measuredByDims": ["D2_Meaning", "D4_Network"],
      "measuredByQts": [],
      "measuredByKeyVars": ["abstractness", "topic_abstractness"],
      "mvpActive": true
    },
    {
      "id": "A2",
      "layer": "A",
      "name": "개념 간 관계 파악",
      "nameEn": "Concept relations",
      "description": "여러 개념의 위계·상호관계 파악",
      "gradeLevel": "csat",
      "measuredByDims": ["D4_Network"],
      "measuredByQts": [],
      "measuredByKeyVars": ["discourse_structure"],
      "mvpActive": true
    },
    {
      "id": "A3",
      "layer": "A",
      "name": "정의-예시 구조 이해",
      "nameEn": "Definition-example structure",
      "description": "추상 정의가 예시로 구체화되는 구조",
      "gradeLevel": "csat",
      "measuredByDims": ["D3_Context"],